client_id,name,new_id,subcontractor id,notes130228,State Government Office of Tourism New South Wales Australian Tourism Office129748,State of Israel129844,State of Tamaulipas130262,State of the Netherlands/Royal Netherlands Embassy129811,States of Guernsey129797,States of Jersey130198,States of Jersey129988,"Stolt-Nielsen, SA"130055,Sudan Liberation Movement (Abdul Wahid)130002,Sunshine Coalition of Uzbekistan130030,"Supporters of Fine Gael, Inc"130216,Suzlon Energy Ltd.130173,Swiss Federation Swiss Embassy of Washington130385,Swiss Private Bankers Assoc.130386,Swiss Private Bankers Association129978,Switzerland Tourism,130237,"Switzerland Tourism, Zurich Switzerland",129833,Taipei Economic And Cultural Representative Office in the United States,129808,Taiwan External Trade Development Council,129812,"Taiwan Trade Center, Inc.",130365,Tajdeed Electoral Slate,129802,"Techsnabexport (""Tenex"")",129914,Temasek Holdings,129999,Tesfu Berhare Teckle,130264,"Thai Trade Center, Los Angeles, Royal Thai Consulate General (Commercial) Office of Commercial Affai",129902,The British Virgin Islands Tourist Board,130062,The Caribbean Tourism Organization,130008,"The City Government of St. Petersburg, Russion Federation",130175,"The City of Heidelberg, Germany",129992,The City of London (through the Latham Group),x130369,The City of Osaka Municipal Government,130250,"The City of St. Petersburg, Russian Federation"130021,The Consulate General of the Republic of Azerbaijan129939,The Development Bank of Japan130174,The Embassy of India130180,The Embassy of Sri Lanka130278,The Embassy of the Islamic Republic of Pakistan130179,The Embassy of the Republic of Azerbaijan129764,The Embassy of the Republic of Peru129778,The Executive of the World Zionist Organization129894,The Federated States of Micronesia130290,The Federated States of Micronesia130096,The Gaddafi International Charity and Development Foundation130184,The Government of Albania130034,The Government of Hong Kong Special Administrative Region130219,The Government of Israel130259,"The Government of Morocco, Embassy"130072,The Government of the Dominican Republic/Asociacion Dominicana de Hacendos y Agricultores130281,The Government of the Dominican Republic/Asociacion Dominicana de Hacendos y Agricultores129935,The Government of the Kingdom of Saudi Arabia129938,The Government of the Nagorno Karabakh Republic (NKR)130318,The Government of the Peoples Republic of Nagalim130005,The Government of the Peoples Republic of Nagalim The National Socialist Council of Nagalim (I-M)129761,The Government of the Republic of Angola130388,The Government of the Republic of Angola129765,The Government of the Republic of Cameroon130181,The Government of the Republic of Cyprus129961,The Government of the Republic of Liberia129979,The Government of the Republic of Trinidad and Tobago129845,The Government of the United Kingdom130334,The Government of United Mexican States130132,The Grand National Party of Korea129801,The Great Socialist People's Libyan Arab Jamahiriya130197,The Great Socialist People's Libyan Arab Jamahiriya,130205,"The Information Technology Industry Development Agency, ITIDA (through Hill & Knowlton, London)",x130156,The Italian Government And/or Political Party Under Thereof,130244,The Korea Industry Trade Association (K.I.T.A.),130061,The League of Arab States,130315,The Lesotho National Development Corporation,129968,The Lesotho National Development Corporation (LNDC),129965,The Menachem Begin Heritage Foundation,129941,The Ministry of Fisheries in the Government of Iceland,130153,The Ministry of Foreign Affairs of the Republic of Kazakhstan,130060,The Ministry Of Trade & Industry Visit Denmark,130258,The Office of the President of the Federal Republic of Nigeria,130183,The People's Republic of China,130112,"The Province of Nova Scotia, Department of Tourism, Culture and Heritage",130355,The Puntland Development Office,130172,The Puntland State of Somalia,130378,The Republic of Colombia,130261,The Republic of Congo,129897,"The Republic of Iraq, acting through the Ministry of Finance",129896,"The Republic of Liberia, acting through the Minister of Finance",129970,The Republic of Uganda,129881,The Republic of Vanuatu,130182,The Royal Embassy of Saudi Arabia (through Qorvis Communications),x130269,The Royal Hashemite Court of Jordan,129928,The Scottish National Party,130377,"The United Mexican States (""Mexico"")",130295,Tilda LTD,129925,Tilda Rice,129756,Tourism Authority of Thailand,129741,Tourism Development and Investing Company (TDIC),130111,Tourism Ireland Limited,130229,Tourism New South Wales,130140,Tourism New Zealand,129876,Tourism Promotion of Chile,129917,Tourism Queensland (formerly Queensland Tourism and Travel Corporation),129874,Tourism Tasmania,130235,Tourism Toronto,129989,Transitional Somali Federal Government,130203,Turkish Culture & Tourist Office,129793,Turkish Republic of Northern Cyprus,130195,"Turkish Republic of Northern Cyprus, H.E. Dr. Dervis Eroglu",130113,twofour54 FZ-LLC (through Gulf Hill & Knowlton),x129822,UK Trade and Investment USA,129912,Ukraine Parties Of Region Through Davis Manafort International LLC,x129742,Ullens Center for Comtemporary Art,129783,Unifrance Film International,130126,United Arab Emirates,130273,United Mexican States,130274,United Mexican States (Kraiem)129899,Urenco Limited129903,Utrok Atoll Local Government130069,Vacci-Test Corporation130003,Venezuela129815,Via Rail130031,VisitBritain129882,Visitsweden (Former Sverigesrese & Turistrad)129875,Welsh Development Agency129997,Williams Mullen continued to represent the Government of Romania.129996,Williams Mullen Strategies continues to represent the Government of Romania.129890,Xin Min Evening Newspaper130019,"Yulia Tymoshenko, Bloc of Yulia Tymoshenko (BYuT)"